{
  "automatic_install": false,
  "automatic_remove": false,
  "automatic_telemetry": false,
  "automatic_update": false,
  "customer_data_included": false,
  "decisions": [
    {
      "action": "inspect or edit the local skill manually",
      "automatic_install": false,
      "automatic_remove": false,
      "automatic_telemetry": false,
      "automatic_update": false,
      "case": "local_mit_skill",
      "customer_data_included": false,
      "fallback": "Use local search/list/view without hosted recommendation actions.",
      "fixture_only": true,
      "full_catalog_distribution": false,
      "hosted_query_forwarding": false,
      "installed_version": "",
      "item_id": "local:python_testing",
      "local_paths_included": false,
      "next_command": "unlimited-skills view python-testing",
      "outcome": "local_only",
      "owner": "user",
      "preview_only": true,
      "private_keys_included": false,
      "prompts_included": false,
      "proofs_included": false,
      "reason": "Local MIT skills remain available offline, but hosted install/update recommendations do not apply.",
      "recommended_channel": "stable",
      "recommended_version": "",
      "refusal_code": "local_only",
      "repo_paths_included": false,
      "skill_bodies_included": false,
      "skill_rewriting": false,
      "source_type": "local_mit",
      "status": "local",
      "task_text_included": false,
      "tokens_included": false,
      "will_install": false,
      "will_remove": false,
      "will_update": false
    },
    {
      "automatic_install": false,
      "automatic_remove": false,
      "automatic_telemetry": false,
      "automatic_update": false,
      "case": "hosted_official_catalog_item",
      "customer_data_included": false,
      "fixture_only": true,
      "full_catalog_distribution": false,
      "hosted_query_forwarding": false,
      "installed_version": "",
      "item_id": "official:ecc:python_testing",
      "local_paths_included": false,
      "next_command": "unlimited-skills catalog preview official:ecc:python_testing",
      "outcome": "allow_install",
      "preview_only": true,
      "private_keys_included": false,
      "prompts_included": false,
      "proofs_included": false,
      "reason": "Signed official catalog metadata meets the public install threshold for the stable channel.",
      "recommended_channel": "stable",
      "recommended_version": "0.4.0",
      "repo_paths_included": false,
      "skill_bodies_included": false,
      "skill_rewriting": false,
      "source_type": "hosted_official",
      "status": "active",
      "task_text_included": false,
      "tokens_included": false,
      "will_install": false,
      "will_remove": false,
      "will_update": false
    },
    {
      "automatic_install": false,
      "automatic_remove": false,
      "automatic_telemetry": false,
      "automatic_update": false,
      "case": "community_catalog_item",
      "customer_data_included": false,
      "fixture_only": true,
      "full_catalog_distribution": false,
      "hosted_query_forwarding": false,
      "installed_version": "",
      "item_id": "community:browser_qa_pack:0.1.0",
      "local_paths_included": false,
      "next_command": "unlimited-skills catalog preview community:browser_qa_pack:0.1.0",
      "outcome": "allow_preview",
      "preview_only": true,
      "private_keys_included": false,
      "prompts_included": false,
      "proofs_included": false,
      "reason": "Community catalog metadata can be previewed, while install still requires explicit user confirmation.",
      "recommended_channel": "stable",
      "recommended_version": "0.1.0",
      "repo_paths_included": false,
      "skill_bodies_included": false,
      "skill_rewriting": false,
      "source_type": "community_catalog",
      "status": "active",
      "task_text_included": false,
      "tokens_included": false,
      "will_install": false,
      "will_remove": false,
      "will_update": false
    },
    {
      "action": "grant team-pack entitlement for this installation",
      "automatic_install": false,
      "automatic_remove": false,
      "automatic_telemetry": false,
      "automatic_update": false,
      "case": "private_team_pack_item",
      "customer_data_included": false,
      "fallback": "Use public catalog alternatives.",
      "fixture_only": true,
      "full_catalog_distribution": false,
      "hosted_query_forwarding": false,
      "installed_version": "",
      "item_id": "team_pack:qa_tools:browser_qa",
      "local_paths_included": false,
      "next_command": "unlimited-skills plan status",
      "outcome": "require_entitlement",
      "owner": "organization admin",
      "preview_only": true,
      "private_keys_included": false,
      "prompts_included": false,
      "proofs_included": false,
      "reason": "Team-pack recommendations require an entitlement check before preview or install advice is shown.",
      "recommended_channel": "stable",
      "recommended_version": "",
      "refusal_code": "entitlement_denied",
      "repo_paths_included": false,
      "skill_bodies_included": false,
      "skill_rewriting": false,
      "source_type": "private_team_pack",
      "status": "entitlement_required",
      "task_text_included": false,
      "tokens_included": false,
      "will_install": false,
      "will_remove": false,
      "will_update": false
    },
    {
      "automatic_install": false,
      "automatic_remove": false,
      "automatic_telemetry": false,
      "automatic_update": false,
      "case": "deprecated",
      "customer_data_included": false,
      "fixture_only": true,
      "full_catalog_distribution": false,
      "hosted_query_forwarding": false,
      "installed_version": "",
      "item_id": "community:legacy_browser_qa:0.1.0",
      "local_paths_included": false,
      "next_command": "unlimited-skills catalog deprecation-status community:legacy_browser_qa:0.1.0",
      "outcome": "warn_before_install",
      "preview_only": true,
      "private_keys_included": false,
      "prompts_included": false,
      "proofs_included": false,
      "reason": "The item is deprecated but has a signed replacement path; require an explicit warning before install.",
      "recommended_channel": "stable",
      "recommended_version": "0.2.0",
      "repo_paths_included": false,
      "skill_bodies_included": false,
      "skill_rewriting": false,
      "source_type": "community_catalog",
      "status": "deprecated",
      "task_text_included": false,
      "tokens_included": false,
      "will_install": false,
      "will_remove": false,
      "will_update": false
    },
    {
      "action": "publish a replacement mapping before any future recommendation",
      "automatic_install": false,
      "automatic_remove": false,
      "automatic_telemetry": false,
      "automatic_update": false,
      "case": "retired",
      "customer_data_included": false,
      "fallback": "Pin or remove the retired item manually after review.",
      "fixture_only": true,
      "full_catalog_distribution": false,
      "hosted_query_forwarding": false,
      "installed_version": "0.1.0",
      "item_id": "community:retired_browser_qa:0.1.0",
      "local_paths_included": false,
      "next_command": "unlimited-skills catalog deprecation-status community:retired_browser_qa:0.1.0",
      "outcome": "deny_update",
      "owner": "catalog maintainer",
      "preview_only": true,
      "private_keys_included": false,
      "prompts_included": false,
      "proofs_included": false,
      "reason": "Retired items must not receive update recommendations; use replacement metadata if available.",
      "recommended_channel": "stable",
      "recommended_version": "",
      "refusal_code": "retired_item",
      "repo_paths_included": false,
      "skill_bodies_included": false,
      "skill_rewriting": false,
      "source_type": "community_catalog",
      "status": "retired",
      "task_text_included": false,
      "tokens_included": false,
      "will_install": false,
      "will_remove": false,
      "will_update": false
    },
    {
      "action": "clear the blocker or publish a replacement",
      "automatic_install": false,
      "automatic_remove": false,
      "automatic_telemetry": false,
      "automatic_update": false,
      "case": "blocked",
      "customer_data_included": false,
      "fallback": "Do not install this item.",
      "fixture_only": true,
      "full_catalog_distribution": false,
      "hosted_query_forwarding": false,
      "installed_version": "",
      "item_id": "community:blocked_pack:0.1.0",
      "local_paths_included": false,
      "next_command": "unlimited-skills catalog quality-status community:blocked_pack:0.1.0",
      "outcome": "deny_install",
      "owner": "catalog maintainer",
      "preview_only": true,
      "private_keys_included": false,
      "prompts_included": false,
      "proofs_included": false,
      "reason": "Blocked items cannot be installed from recommendation previews.",
      "recommended_channel": "stable",
      "recommended_version": "",
      "refusal_code": "blocked_item",
      "repo_paths_included": false,
      "skill_bodies_included": false,
      "skill_rewriting": false,
      "source_type": "community_catalog",
      "status": "blocked",
      "task_text_included": false,
      "tokens_included": false,
      "will_install": false,
      "will_remove": false,
      "will_update": false
    },
    {
      "action": "raise the quality score before install recommendation",
      "automatic_install": false,
      "automatic_remove": false,
      "automatic_telemetry": false,
      "automatic_update": false,
      "case": "low_score",
      "customer_data_included": false,
      "fallback": "Preview metadata only.",
      "fixture_only": true,
      "full_catalog_distribution": false,
      "hosted_query_forwarding": false,
      "installed_version": "",